id,state,category,organization,title,project_value,deadline,ai_score,eligibility,emd,contractor_class,experience,description,direct_url
1,Chhattisgarh,Civil Works,PWD Raipur,Construction of CC Road and Drainage Network in Gudiyaari,₹ 45.00 L,24 Jun 2026,96%,Eligible,₹ 45000,Class C,1-3 Years,Full-scale excavation and laying of cement concrete roadbeds with integrated subterranean stormwater drainage systems.,https://eproc.cgstate.gov.in
2,Chhattisgarh,Electrical,Bilaspur Nagar Nigam,Supply and Installation of 250W Smart LED Streetlights,₹ 12.00 L,10 Jul 2026,88%,Eligible,₹ 12000,Class D,No Experience,Procurement and grid integration of energy-efficient 250W smart web-connected LED luminaires.,https://www.cguadfinance.in
3,Chhattisgarh,Coal Supply,SECL Bilaspur,Supply and Mechanical Transportation of Coal (500 MT),₹ 2.36 Cr,01 Aug 2026,98%,Eligible,₹ 236000,Class A,3+ Years,Large-scale industrial transport operations involving lifting bulk crushed coal from open-cast stockpiles.,https://ansh.secl-cil.in
4,Chhattisgarh,Medical Supply,CGMSC Raipur,Bulk Sourcing of Digital 12-Lead ECG Machines,₹ 35.00 L,22 Jul 2026,92%,Eligible,Exempted,Open,1-3 Years,Comprehensive supply logistical distribution and on-site calibration for medical-grade diagnostic equipment.,https://eproc.cgstate.gov.in
5,Chhattisgarh,Government Jobs,CGPSC Raipur,Junior Engineer (Civil) Recruitment,₹ 45000 /mo,28 Jul 2026,85%,Review Required,Exempted,N/A,No Experience,Core technical deployment within the public works division managing rural highway design layout mappings.,https://psc.cg.gov.in
6,Chhattisgarh,Medical Supply,Apollo Hospitals Raipur,Senior Staff Nurse Openings,₹ 35000 /mo,19 Jul 2026,78%,Review Required,Exempted,N/A,1-3 Years,Immediate clinical placements for managing emergency triage units and patient critical charts.,https://www.apollohospitals.com
7,Chhattisgarh,IT Services,CHiPS Raipur,Data Center Network Administrator,₹ 75000 /mo,05 Aug 2026,89%,Eligible,Exempted,N/A,3+ Years,Full-time cloud cluster tracking managing hardware firewalls patch update arrays inside the central hub.,https://chips.gov.in
8,Chhattisgarh,Civil Works,RES Durg Sector,Water Pipeline and Storage Tank Installation,₹ 22.00 L,29 Jul 2026,94%,Eligible,₹ 22000,Class D,1-3 Years,Excavation and laying of localized HDPE piping distribution tracks and 50KL drinking water storage tanks.,https://egramswaraj.gov.in
9,Uttar Pradesh,Civil Works,UP PWD Gonda,Special Repair and Widening of DMB Highway,₹ 1.85 Cr,18 Jul 2026,91%,Eligible,₹ 185000,Class A,3+ Years,Asphalt overlaying shoulder reinforcement and curve correction over a